Listing datasets with prefix 'RoboCOIN/' from Hugging Face...
Found 397 datasets.

[1/397] Processing RoboCOIN/AIRBOT_MMK2_beauty_sponge_and_cake_to_place...
  Collected metadata and stats for AIRBOT MMK2
  Collected 5 subtask lengths from first episode

[2/397] Processing RoboCOIN/AIRBOT_MMK2_bowl_storage_pepper...
  Collected metadata and stats for AIRBOT MMK2
  Collected 4 subtask lengths from first episode

[3/397] Processing RoboCOIN/AIRBOT_MMK2_boxs_storage...
  Collected metadata and stats for AIRBOT MMK2
  Collected 6 subtask lengths from first episode

[4/397] Processing RoboCOIN/AIRBOT_MMK2_building_block_storage...
  Collected metadata and stats for AIRBOT MMK2
  Collected 5 subtask lengths from first episode

[5/397] Processing RoboCOIN/AIRBOT_MMK2_cake_storage...
  Collected metadata and stats for AIRBOT MMK2
  Collected 3 subtask lengths from first episode

[6/397] Processing RoboCOIN/AIRBOT_MMK2_chop_the_scallions...
  Collected metadata and stats for AIRBOT MMK2
  Collected 6 subtask lengths from first episode

[7/397] Processing RoboCOIN/AIRBOT_MMK2_clean_the_desktop...
  Collected metadata and stats for AIRBOT MMK2
  Collected 5 subtask lengths from first episode

[8/397] Processing RoboCOIN/AIRBOT_MMK2_clean_the_desktop_a...
  Collected metadata and stats for AIRBOT MMK2
  Collected 4 subtask lengths from first episode

[9/397] Processing RoboCOIN/AIRBOT_MMK2_close_the_computer...
  Collected metadata and stats for AIRBOT MMK2
  Collected 6 subtask lengths from first episode

[10/397] Processing RoboCOIN/AIRBOT_MMK2_cup_storage...
  Collected metadata and stats for AIRBOT MMK2
  Collected 5 subtask lengths from first episode

[11/397] Processing RoboCOIN/AIRBOT_MMK2_desktop_storage...
  Collected metadata and stats for AIRBOT MMK2
  Collected 5 subtask lengths from first episode

[12/397] Processing RoboCOIN/AIRBOT_MMK2_diamond_storage...
  Collected metadata and stats for AIRBOT MMK2
  Collected 4 subtask lengths from first episode

[13/397] Processing RoboCOIN/AIRBOT_MMK2_double-sided_tape_placement...
  Collected metadata and stats for AIRBOT MMK2
  Collected 5 subtask lengths from first episode

[14/397] Processing RoboCOIN/AIRBOT_MMK2_egg_storage...
  Collected metadata and stats for AIRBOT MMK2
  Collected 5 subtask lengths from first episode

[15/397] Processing RoboCOIN/AIRBOT_MMK2_food_storage...
  Collected metadata and stats for AIRBOT MMK2
  Collected 4 subtask lengths from first episode

[16/397] Processing RoboCOIN/AIRBOT_MMK2_item_storage...
  Collected metadata and stats for AIRBOT MMK2
  Collected 7 subtask lengths from first episode

[17/397] Processing RoboCOIN/AIRBOT_MMK2_lemon_and_orange_storage...
  Collected metadata and stats for AIRBOT MMK2
  Collected 6 subtask lengths from first episode

[18/397] Processing RoboCOIN/AIRBOT_MMK2_medicine_bottle_storage...
  Collected metadata and stats for AIRBOT MMK2
  Collected 7 subtask lengths from first episode

[19/397] Processing RoboCOIN/AIRBOT_MMK2_mobile_calculator_box...
  Collected metadata and stats for AIRBOT MMK2
  Collected 4 subtask lengths from first episode

[20/397] Processing RoboCOIN/AIRBOT_MMK2_mobile_car...
  Collected metadata and stats for AIRBOT MMK2
  Collected 4 subtask lengths from first episode

[21/397] Processing RoboCOIN/AIRBOT_MMK2_mobile_phone_storage...
  Collected metadata and stats for AIRBOT MMK2
  Collected 6 subtask lengths from first episode

[22/397] Processing RoboCOIN/AIRBOT_MMK2_open_notebook...
  Collected metadata and stats for AIRBOT MMK2
  Collected 6 subtask lengths from first episode

[23/397] Processing RoboCOIN/AIRBOT_MMK2_organize_and_place_books...
  Collected metadata and stats for AIRBOT MMK2
  Collected 6 subtask lengths from first episode

[24/397] Processing RoboCOIN/AIRBOT_MMK2_organize_books...
  Collected metadata and stats for AIRBOT MMK2
  Collected 5 subtask lengths from first episode

[25/397] Processing RoboCOIN/AIRBOT_MMK2_place_cookies_and_beer...
  Collected metadata and stats for AIRBOT MMK2
  Collected 5 subtask lengths from first episode

[26/397] Processing RoboCOIN/AIRBOT_MMK2_place_the_basin...
  Collected metadata and stats for AIRBOT MMK2
  Collected 8 subtask lengths from first episode

[27/397] Processing RoboCOIN/AIRBOT_MMK2_place_the_blue_and_purple_blocks...
  Collected metadata and stats for AIRBOT MMK2
  Collected 6 subtask lengths from first episode

[28/397] Processing RoboCOIN/AIRBOT_MMK2_place_the_books...
  Collected metadata and stats for AIRBOT MMK2
  Collected 5 subtask lengths from first episode

[29/397] Processing RoboCOIN/AIRBOT_MMK2_place_the_building_blocks...
  Collected metadata and stats for AIRBOT MMK2
  Collected 7 subtask lengths from first episode

[30/397] Processing RoboCOIN/AIRBOT_MMK2_place_the_cake...
  Collected metadata and stats for AIRBOT MMK2
  Collected 6 subtask lengths from first episode

[31/397] Processing RoboCOIN/AIRBOT_MMK2_place_the_glasses_case_and_gold_bars...
  Collected metadata and stats for AIRBOT MMK2
  Collected 6 subtask lengths from first episode

[32/397] Processing RoboCOIN/AIRBOT_MMK2_place_the_network_cable_and_mouse_box...
  Collected metadata and stats for AIRBOT MMK2
  Collected 5 subtask lengths from first episode

[33/397] Processing RoboCOIN/AIRBOT_MMK2_place_the_paper_drawer...
  Collected metadata and stats for AIRBOT MMK2
  Collected 3 subtask lengths from first episode

[34/397] Processing RoboCOIN/AIRBOT_MMK2_place_the_piano_and_the_needle-nose_pliers...
  Collected metadata and stats for AIRBOT MMK2
  Collected 6 subtask lengths from first episode

[35/397] Processing RoboCOIN/AIRBOT_MMK2_place_the_pliers_and_wallpaper_knife...
  Collected metadata and stats for AIRBOT MMK2
  Collected 6 subtask lengths from first episode

[36/397] Processing RoboCOIN/AIRBOT_MMK2_place_the_shark_toys_and_gold_bars...
  Collected metadata and stats for AIRBOT MMK2
  Collected 6 subtask lengths from first episode

[37/397] Processing RoboCOIN/AIRBOT_MMK2_place_the_small_bowl_of_canned_food...
  Collected metadata and stats for AIRBOT MMK2
  Collected 3 subtask lengths from first episode

[38/397] Processing RoboCOIN/AIRBOT_MMK2_place_the_umbrella_and_the_ruler...
  Collected metadata and stats for AIRBOT MMK2
  Collected 5 subtask lengths from first episode

[39/397] Processing RoboCOIN/AIRBOT_MMK2_place_the_yellow_block...
  Collected metadata and stats for AIRBOT MMK2
  Collected 5 subtask lengths from first episode

[40/397] Processing RoboCOIN/AIRBOT_MMK2_play_the_guitar...
  Collected metadata and stats for AIRBOT MMK2
  Collected 5 subtask lengths from first episode

[41/397] Processing RoboCOIN/AIRBOT_MMK2_potato_storage...
  Collected metadata and stats for AIRBOT MMK2
  Collected 3 subtask lengths from first episode

[42/397] Processing RoboCOIN/AIRBOT_MMK2_pour_out_the_beauty_blender...
  Collected metadata and stats for AIRBOT MMK2
  Collected 4 subtask lengths from first episode

[43/397] Processing RoboCOIN/AIRBOT_MMK2_pull_the_syringe_piston...
  Collected metadata and stats for AIRBOT MMK2
  Collected 6 subtask lengths from first episode

[44/397] Processing RoboCOIN/AIRBOT_MMK2_pumpkin_storage...
  Collected metadata and stats for AIRBOT MMK2
  Collected 4 subtask lengths from first episode

[45/397] Processing RoboCOIN/AIRBOT_MMK2_push_building_blocks...
  Collected metadata and stats for AIRBOT MMK2
  Collected 7 subtask lengths from first episode

[46/397] Processing RoboCOIN/AIRBOT_MMK2_push_piston...
  Collected metadata and stats for AIRBOT MMK2
  Collected 6 subtask lengths from first episode

[47/397] Processing RoboCOIN/AIRBOT_MMK2_screw_the_bottle_cap...
  Collected metadata and stats for AIRBOT MMK2
  Collected 5 subtask lengths from first episode

[48/397] Processing RoboCOIN/AIRBOT_MMK2_square_arrangement...
  Collected metadata and stats for AIRBOT MMK2
  Collected 3 subtask lengths from first episode

[49/397] Processing RoboCOIN/AIRBOT_MMK2_stacking_blocks...
  Collected metadata and stats for AIRBOT MMK2
  Collected 7 subtask lengths from first episode

[50/397] Processing RoboCOIN/AIRBOT_MMK2_storage_box_for_mouse_and_sponge...
  Collected metadata and stats for AIRBOT MMK2
  Collected 5 subtask lengths from first episode

[51/397] Processing RoboCOIN/AIRBOT_MMK2_storage_computer_box...
  Collected metadata and stats for AIRBOT MMK2
  Collected 4 subtask lengths from first episode

[52/397] Processing RoboCOIN/AIRBOT_MMK2_storage_for_building_blocks_and_beauty_sponges...
  Collected metadata and stats for AIRBOT MMK2
  Collected 6 subtask lengths from first episode

[53/397] Processing RoboCOIN/AIRBOT_MMK2_storage_item...
  Collected metadata and stats for AIRBOT MMK2
  Collected 6 subtask lengths from first episode

[54/397] Processing RoboCOIN/AIRBOT_MMK2_storage_remote_control_clip_box_water_bottle...
  Collected metadata and stats for AIRBOT MMK2
  Collected 5 subtask lengths from first episode

[55/397] Processing RoboCOIN/AIRBOT_MMK2_storage_rubiks_cube_and_cup...
  Collected metadata and stats for AIRBOT MMK2
  Collected 5 subtask lengths from first episode

[56/397] Processing RoboCOIN/AIRBOT_MMK2_storage_spoon...
  Collected metadata and stats for AIRBOT MMK2
  Collected 5 subtask lengths from first episode

[57/397] Processing RoboCOIN/AIRBOT_MMK2_storage_tissue_and_milk_carton...
  Collected metadata and stats for AIRBOT MMK2
  Collected 6 subtask lengths from first episode

[58/397] Processing RoboCOIN/AIRBOT_MMK2_storage_tissue_paper...
  Collected metadata and stats for AIRBOT MMK2
  Collected 6 subtask lengths from first episode

[59/397] Processing RoboCOIN/AIRBOT_MMK2_storage_toy_cars_and_cookies...
  Collected metadata and stats for AIRBOT MMK2
  Collected 5 subtask lengths from first episode

[60/397] Processing RoboCOIN/AIRBOT_MMK2_storage_wet_tissue_and_building_block...
  Collected metadata and stats for AIRBOT MMK2
  Collected 5 subtask lengths from first episode

[61/397] Processing RoboCOIN/AIRBOT_MMK2_store_beauty_blender_and_building_blocks...
  Collected metadata and stats for AIRBOT MMK2
  Collected 6 subtask lengths from first episode

[62/397] Processing RoboCOIN/AIRBOT_MMK2_store_coffee_cups...
  Collected metadata and stats for AIRBOT MMK2
  Collected 5 subtask lengths from first episode

[63/397] Processing RoboCOIN/AIRBOT_MMK2_store_peaches_and_pears...
  Collected metadata and stats for AIRBOT MMK2
  Collected 5 subtask lengths from first episode

[64/397] Processing RoboCOIN/AIRBOT_MMK2_store_pomegranates_and_mangoes...
  Collected metadata and stats for AIRBOT MMK2
  Collected 6 subtask lengths from first episode

[65/397] Processing RoboCOIN/AIRBOT_MMK2_store_wet_wipes_and_bowls...
  Collected metadata and stats for AIRBOT MMK2
  Collected 7 subtask lengths from first episode

[66/397] Processing RoboCOIN/AIRBOT_MMK2_take_down_paper_cup...
  Collected metadata and stats for AIRBOT MMK2
  Collected 5 subtask lengths from first episode

[67/397] Processing RoboCOIN/AIRBOT_MMK2_take_down_umbrella_and_mineral_water...
  Collected metadata and stats for AIRBOT MMK2
  Collected 3 subtask lengths from first episode

[68/397] Processing RoboCOIN/AIRBOT_MMK2_take_the_book...
  Collected metadata and stats for AIRBOT MMK2
  Collected 3 subtask lengths from first episode

[69/397] Processing RoboCOIN/AIRBOT_MMK2_the_cup_is_put_into_the_bucket...
  Collected metadata and stats for AIRBOT MMK2
  Collected 7 subtask lengths from first episode

[70/397] Processing RoboCOIN/AIRBOT_MMK2_toy_storage...
  Collected metadata and stats for AIRBOT MMK2
  Collected 3 subtask lengths from first episode

[71/397] Processing RoboCOIN/AgiBot-g1_battery_storage_b...
  Collected metadata and stats for AgiBot g1
  Collected 2 subtask lengths from first episode

[72/397] Processing RoboCOIN/AgiBot-g1_battery_storage_c...
  Collected metadata and stats for AgiBot g1
  Collected 2 subtask lengths from first episode

[73/397] Processing RoboCOIN/AgiBot-g1_box_storage_a...
  Collected metadata and stats for AgiBot g1
  Collected 2 subtask lengths from first episode

[74/397] Processing RoboCOIN/AgiBot-g1_box_storage_b...
  Collected metadata and stats for AgiBot g1
  Collected 2 subtask lengths from first episode

[75/397] Processing RoboCOIN/AgiBot-g1_box_storage_c...
  Collected metadata and stats for AgiBot g1
  Collected 3 subtask lengths from first episode

[76/397] Processing RoboCOIN/AgiBot-g1_box_storage_cardboard_box_a...
  Collected metadata and stats for AgiBot g1
  Collected 2 subtask lengths from first episode

[77/397] Processing RoboCOIN/AgiBot-g1_box_storage_cardboard_box_b...
  Collected metadata and stats for AgiBot g1
  Collected 2 subtask lengths from first episode

[78/397] Processing RoboCOIN/AgiBot-g1_box_storage_cardboard_box_c...
  Collected metadata and stats for AgiBot g1
  Collected 2 subtask lengths from first episode

[79/397] Processing RoboCOIN/AgiBot-g1_box_storage_e...
  Collected metadata and stats for AgiBot g1
  Collected 2 subtask lengths from first episode

[80/397] Processing RoboCOIN/AgiBot-g1_box_storage_part_a...
  Collected metadata and stats for AgiBot g1
  Collected 2 subtask lengths from first episode

[81/397] Processing RoboCOIN/AgiBot-g1_box_storage_tool...
  Renamed 'AgiBot g1' -> 'AgiBot g1 41' (state_dim=41)
  Using key 'AgiBot g1 17' for AgiBot g1 with state_dim=17
  Collected metadata and stats for AgiBot g1 17
  Collected 4 subtask lengths from first episode

[82/397] Processing RoboCOIN/AgiBot-g1_left_capture_part...
  Collected metadata and stats for AgiBot g1 41
  Collected 2 subtask lengths from first episode

[83/397] Processing RoboCOIN/AgiBot-g1_mobile_accessory_storage_box_a...
  Collected metadata and stats for AgiBot g1 41
  Collected 2 subtask lengths from first episode

[84/397] Processing RoboCOIN/AgiBot-g1_mobile_accessory_storage_box_c...
  Collected metadata and stats for AgiBot g1 41
  Collected 3 subtask lengths from first episode

[85/397] Processing RoboCOIN/AgiBot-g1_mobile_accessory_storage_box_d...
  Collected metadata and stats for AgiBot g1 41
  Collected 3 subtask lengths from first episode

[86/397] Processing RoboCOIN/AgiBot-g1_mobile_accessory_storage_box_e...
  Collected metadata and stats for AgiBot g1 41
  Collected 2 subtask lengths from first episode

[87/397] Processing RoboCOIN/AgiBot-g1_mobile_accessory_storage_box_f...
  Collected metadata and stats for AgiBot g1 41
  Collected 2 subtask lengths from first episode

[88/397] Processing RoboCOIN/AgiBot-g1_pick_up_battery...
  Collected metadata and stats for AgiBot g1 41
  Collected 2 subtask lengths from first episode

[89/397] Processing RoboCOIN/AgiBot-g1_picks_up_battery_a...
  Collected metadata and stats for AgiBot g1 41
  Collected 2 subtask lengths from first episode

[90/397] Processing RoboCOIN/AgiBot-g1_picks_up_battery_b...
  Collected metadata and stats for AgiBot g1 41
  Collected 2 subtask lengths from first episode

[91/397] Processing RoboCOIN/AgiBot-g1_picks_up_cardboard_box...
  Collected metadata and stats for AgiBot g1 41
  Collected 3 subtask lengths from first episode

[92/397] Processing RoboCOIN/AgiBot-g1_picks_up_parts_a...
  Collected metadata and stats for AgiBot g1 41
  Collected 2 subtask lengths from first episode

[93/397] Processing RoboCOIN/AgiBot-g1_picks_up_parts_b...
  Collected metadata and stats for AgiBot g1 41
  Collected 2 subtask lengths from first episode

[94/397] Processing RoboCOIN/AgiBot-g1_remove_the_accessory...
  Collected metadata and stats for AgiBot g1 41
  Collected 2 subtask lengths from first episode

[95/397] Processing RoboCOIN/AgiBot-g1_right_capture_part...
  Collected metadata and stats for AgiBot g1 41
  Collected 2 subtask lengths from first episode

[96/397] Processing RoboCOIN/AgiBot-g1_robotic_arm_picks_up_battery...
  Collected metadata and stats for AgiBot g1 41
  Collected 2 subtask lengths from first episode

[97/397] Processing RoboCOIN/AgiBot-g1_robotic_arm_picks_up_parts...
  Collected metadata and stats for AgiBot g1 41
  Collected 2 subtask lengths from first episode

[98/397] Processing RoboCOIN/AgiBot-g1_storage_item_b...
  Collected metadata and stats for AgiBot g1 41
  Collected 2 subtask lengths from first episode

[99/397] Processing RoboCOIN/AgiBot-g1_storage_item_d...
  Collected metadata and stats for AgiBot g1 41
  Collected 2 subtask lengths from first episode

[100/397] Processing RoboCOIN/AgiBot-g1_storage_item_e...
  Collected metadata and stats for AgiBot g1 41
  Collected 2 subtask lengths from first episode

[101/397] Processing RoboCOIN/AgiBot-g1_tool_storage...
  Collected metadata and stats for AgiBot g1 41
  Collected 2 subtask lengths from first episode

[102/397] Processing RoboCOIN/Cobot_Magic_box_storage_chopsticks...
  Collected metadata and stats for Cobot Magic
  Collected 2 subtask lengths from first episode

[103/397] Processing RoboCOIN/Cobot_Magic_cap_the_pen_a...
  Collected metadata and stats for Cobot Magic
  Collected 6 subtask lengths from first episode

[104/397] Processing RoboCOIN/Cobot_Magic_catch_the_ball...
  Collected metadata and stats for Cobot Magic
  Collected 4 subtask lengths from first episode

[105/397] Processing RoboCOIN/Cobot_Magic_classification_of_fruits_and_vegetables...
  Collected metadata and stats for Cobot Magic
  Collected 4 subtask lengths from first episode

[106/397] Processing RoboCOIN/Cobot_Magic_classification_of_fruits_and_vegetables_a...
  Collected metadata and stats for Cobot Magic
  Collected 4 subtask lengths from first episode

[107/397] Processing RoboCOIN/Cobot_Magic_classification_of_tableware...
  Collected metadata and stats for Cobot Magic
  Collected 10 subtask lengths from first episode

[108/397] Processing RoboCOIN/Cobot_Magic_clean_blackboard...
  Renamed 'Cobot Magic' -> 'Cobot Magic 14' (state_dim=14)
  Using key 'Cobot Magic 26' for Cobot Magic with state_dim=26
  Collected metadata and stats for Cobot Magic 26
  Collected 6 subtask lengths from first episode

[109/397] Processing RoboCOIN/Cobot_Magic_clean_up_the_tableware...
  Collected metadata and stats for Cobot Magic 14
  Collected 7 subtask lengths from first episode

[110/397] Processing RoboCOIN/Cobot_Magic_clear_the_desktop...
  Collected metadata and stats for Cobot Magic 14
  Collected 1 subtask lengths from first episode

[111/397] Processing RoboCOIN/Cobot_Magic_close_book...
  Collected metadata and stats for Cobot Magic 14
  Collected 1 subtask lengths from first episode

[112/397] Processing RoboCOIN/Cobot_Magic_close_button...
  Collected metadata and stats for Cobot Magic 14
  Collected 1 subtask lengths from first episode

[113/397] Processing RoboCOIN/Cobot_Magic_cube_reset...
  Collected metadata and stats for Cobot Magic 26
  Collected 2 subtask lengths from first episode

[114/397] Processing RoboCOIN/Cobot_Magic_cut_banana...
  Collected metadata and stats for Cobot Magic 26
  Collected 7 subtask lengths from first episode

[115/397] Processing RoboCOIN/Cobot_Magic_desktop_organization...
  Collected metadata and stats for Cobot Magic 26
  Collected 21 subtask lengths from first episode

[116/397] Processing RoboCOIN/Cobot_Magic_drawer_storage_mineral_water...
  Collected metadata and stats for Cobot Magic 14
  Collected 3 subtask lengths from first episode

[117/397] Processing RoboCOIN/Cobot_Magic_fold_clothes...
  Collected metadata and stats for Cobot Magic 14
  Collected 8 subtask lengths from first episode

[118/397] Processing RoboCOIN/Cobot_Magic_fold_the_towel...
  Collected metadata and stats for Cobot Magic 14
  Collected 1 subtask lengths from first episode

[119/397] Processing RoboCOIN/Cobot_Magic_fold_towel_a...
  Collected metadata and stats for Cobot Magic 14
  Collected 2 subtask lengths from first episode

[120/397] Processing RoboCOIN/Cobot_Magic_food_packaging...
  Collected metadata and stats for Cobot Magic 26
  Collected 13 subtask lengths from first episode

[121/397] Processing RoboCOIN/Cobot_Magic_make_fruit_salad...
  Collected metadata and stats for Cobot Magic 26
  Collected 5 subtask lengths from first episode

[122/397] Processing RoboCOIN/Cobot_Magic_make_hamburger...
  Collected metadata and stats for Cobot Magic 26
  Collected 3 subtask lengths from first episode

[123/397] Processing RoboCOIN/Cobot_Magic_mobile_cube...
  Collected metadata and stats for Cobot Magic 26
  Collected 3 subtask lengths from first episode

[124/397] Processing RoboCOIN/Cobot_Magic_mobile_cube_blackboard...
  Collected metadata and stats for Cobot Magic 26
  Collected 20 subtask lengths from first episode

[125/397] Processing RoboCOIN/Cobot_Magic_move_beverage...
  Collected metadata and stats for Cobot Magic 26
  Collected 2 subtask lengths from first episode

[126/397] Processing RoboCOIN/Cobot_Magic_move_plate...
  Collected metadata and stats for Cobot Magic 26
  Collected 2 subtask lengths from first episode

[127/397] Processing RoboCOIN/Cobot_Magic_move_the_ball...
  Collected metadata and stats for Cobot Magic 26
  Collected 4 subtask lengths from first episode

[128/397] Processing RoboCOIN/Cobot_Magic_move_the_ball_and_the_cube_block...
  Collected metadata and stats for Cobot Magic 26
  Collected 2 subtask lengths from first episode

[129/397] Processing RoboCOIN/Cobot_Magic_move_the_ball_interference...
  Collected metadata and stats for Cobot Magic 26
  Collected 2 subtask lengths from first episode

[130/397] Processing RoboCOIN/Cobot_Magic_move_the_bread...
  Collected metadata and stats for Cobot Magic 14
  Collected 4 subtask lengths from first episode

[131/397] Processing RoboCOIN/Cobot_Magic_move_the_cup...
  Collected metadata and stats for Cobot Magic 14
  Collected 2 subtask lengths from first episode

[132/397] Processing RoboCOIN/Cobot_Magic_move_the_plate...
  Collected metadata and stats for Cobot Magic 14
  Collected 2 subtask lengths from first episode

[133/397] Processing RoboCOIN/Cobot_Magic_move_the_small_ball...
  Collected metadata and stats for Cobot Magic 14
  Collected 2 subtask lengths from first episode

[134/397] Processing RoboCOIN/Cobot_Magic_movethe_position_of_the_bluetooth...
  Collected metadata and stats for Cobot Magic 14
  Collected 2 subtask lengths from first episode

[135/397] Processing RoboCOIN/Cobot_Magic_open_the_shoebox...
  Collected metadata and stats for Cobot Magic 14
  Collected 1 subtask lengths from first episode

[136/397] Processing RoboCOIN/Cobot_Magic_place_square_pyramid...
  Collected metadata and stats for Cobot Magic 26
  Collected 2 subtask lengths from first episode

[137/397] Processing RoboCOIN/Cobot_Magic_place_the_cube_block...
  Collected metadata and stats for Cobot Magic 26
  Collected 2 subtask lengths from first episode

[138/397] Processing RoboCOIN/Cobot_Magic_place_the_test_tube...
  Collected metadata and stats for Cobot Magic 14
  Collected 2 subtask lengths from first episode

[139/397] Processing RoboCOIN/Cobot_Magic_plate_storage_apple...
  Collected metadata and stats for Cobot Magic 14
  Collected 2 subtask lengths from first episode

[140/397] Processing RoboCOIN/Cobot_Magic_plate_storage_bread...
  Collected metadata and stats for Cobot Magic 14
  Collected 2 subtask lengths from first episode

[141/397] Processing RoboCOIN/Cobot_Magic_plate_storaje_baozi...
  Collected metadata and stats for Cobot Magic 14
  Collected 6 subtask lengths from first episode

[142/397] Processing RoboCOIN/Cobot_Magic_pot_storage_steamer...
  Collected metadata and stats for Cobot Magic 14
  Collected 4 subtask lengths from first episode

[143/397] Processing RoboCOIN/Cobot_Magic_pour_drink...
  Collected metadata and stats for Cobot Magic 26
  Collected 7 subtask lengths from first episode

[144/397] Processing RoboCOIN/Cobot_Magic_pour_water_a...
  Collected metadata and stats for Cobot Magic 26
  Collected 9 subtask lengths from first episode

[145/397] Processing RoboCOIN/Cobot_Magic_pour_water_bottle...
  Collected metadata and stats for Cobot Magic 26
  Collected 2 subtask lengths from first episode

[146/397] Processing RoboCOIN/Cobot_Magic_prepare_breakfast...
  Collected metadata and stats for Cobot Magic 26
  Collected 5 subtask lengths from first episode

[147/397] Processing RoboCOIN/Cobot_Magic_pull_zipper...
  Collected metadata and stats for Cobot Magic 26
  Collected 5 subtask lengths from first episode

[148/397] Processing RoboCOIN/Cobot_Magic_pushing_magnet...
  Collected metadata and stats for Cobot Magic 26
  Collected 2 subtask lengths from first episode

[149/397] Processing RoboCOIN/Cobot_Magic_put_in_the_pear...
  Collected metadata and stats for Cobot Magic 14
  Collected 2 subtask lengths from first episode

[150/397] Processing RoboCOIN/Cobot_Magic_put_the_building_block_on_the_table...
  Collected metadata and stats for Cobot Magic 14
  Collected 2 subtask lengths from first episode

[151/397] Processing RoboCOIN/Cobot_Magic_steamer_storage_dumpling...
  Collected metadata and stats for Cobot Magic 14
  Collected 8 subtask lengths from first episode

[152/397] Processing RoboCOIN/Cobot_Magic_storage_plate...
  Collected metadata and stats for Cobot Magic 14
  Collected 4 subtask lengths from first episode

[153/397] Processing RoboCOIN/Cobot_Magic_take_out_a_pen_from_the_pen_holder...
  Collected metadata and stats for Cobot Magic 14
  Collected 1 subtask lengths from first episode

[154/397] Processing RoboCOIN/Cobot_Magic_take_out_the_bread...
  Collected metadata and stats for Cobot Magic 14
  Collected 4 subtask lengths from first episode

[155/397] Processing RoboCOIN/Cobot_Magic_take_the_shoes_off_the_shelf...
  Collected metadata and stats for Cobot Magic 14
  Collected 4 subtask lengths from first episode

[156/397] Processing RoboCOIN/Cobot_Magic_the_box_stores_table_tennis_balls...
  Collected metadata and stats for Cobot Magic 14
  Collected 4 subtask lengths from first episode

[157/397] Processing RoboCOIN/Cobot_Magic_the_plate_holds_the_fruit...
  Collected metadata and stats for Cobot Magic 14
  Collected 2 subtask lengths from first episode

[158/397] Processing RoboCOIN/Cobot_Magic_the_plate_holds_the_vegetables...
  Collected metadata and stats for Cobot Magic 14
  Collected 3 subtask lengths from first episode

[159/397] Processing RoboCOIN/Cobot_Magic_turn_off_the_desk_lamp...
  Collected metadata and stats for Cobot Magic 14
  Collected 1 subtask lengths from first episode

[160/397] Processing RoboCOIN/Cobot_Magic_turn_on_the_bulb...
  Collected metadata and stats for Cobot Magic 14
  Collected 2 subtask lengths from first episode

[161/397] Processing RoboCOIN/Cobot_Magic_turn_on_the_desk_lamp...
  Collected metadata and stats for Cobot Magic 14
  Collected 1 subtask lengths from first episode

[162/397] Processing RoboCOIN/Cobot_Magic_twist_bottle_cap...
  Collected metadata and stats for Cobot Magic 26
  Collected 5 subtask lengths from first episode

[163/397] Processing RoboCOIN/Cobot_Magic_vase_storage_flower...
  Collected metadata and stats for Cobot Magic 14
  Collected 4 subtask lengths from first episode

[164/397] Processing RoboCOIN/Cobot_Magic_water_bottle_storage...
  Collected metadata and stats for Cobot Magic 26
  Collected 3 subtask lengths from first episode

[165/397] Processing RoboCOIN/G1edu-u3_basket_storage_apple...
  Collected metadata and stats for G1edu u3
  Collected 7 subtask lengths from first episode

[166/397] Processing RoboCOIN/G1edu-u3_bowl_storage_grape_singletry...
  Collected metadata and stats for G1edu u3
  Collected 3 subtask lengths from first episode

[167/397] Processing RoboCOIN/G1edu-u3_food_storage...
  Collected metadata and stats for G1edu u3
  Collected 7 subtask lengths from first episode

[168/397] Processing RoboCOIN/G1edu-u3_little_tray_storage_apple_b...
  Renamed 'G1edu u3' -> 'G1edu u3 28' (state_dim=28)
  Using key 'G1edu u3 30' for G1edu u3 with state_dim=30
  Collected metadata and stats for G1edu u3 30
  Collected 2 subtask lengths from first episode

[169/397] Processing RoboCOIN/G1edu-u3_little_tray_storage_lemon_b...
  Collected metadata and stats for G1edu u3 30
  Collected 2 subtask lengths from first episode

[170/397] Processing RoboCOIN/G1edu-u3_pick_apple_a...
  Collected metadata and stats for G1edu u3 30
  Collected 2 subtask lengths from first episode

[171/397] Processing RoboCOIN/G1edu-u3_pick_apple_b...
  Collected metadata and stats for G1edu u3 30
  Collected 2 subtask lengths from first episode

[172/397] Processing RoboCOIN/G1edu-u3_pick_crumpled_paper_aa...
  Collected metadata and stats for G1edu u3 30
  Collected 2 subtask lengths from first episode

[173/397] Processing RoboCOIN/G1edu-u3_pick_cup_a...
  Collected metadata and stats for G1edu u3 30
  Collected 2 subtask lengths from first episode

[174/397] Processing RoboCOIN/G1edu-u3_pick_empty_bottle_ab...
  Collected metadata and stats for G1edu u3 30
  Collected 2 subtask lengths from first episode

[175/397] Processing RoboCOIN/G1edu-u3_pick_leftover_food_ac...
  Collected metadata and stats for G1edu u3 30
  Collected 2 subtask lengths from first episode

[176/397] Processing RoboCOIN/G1edu-u3_pick_metal_bowl_aa...
  Collected metadata and stats for G1edu u3 30
  Collected 3 subtask lengths from first episode

[177/397] Processing RoboCOIN/G1edu-u3_pick_metal_bowl_ab...
  Collected metadata and stats for G1edu u3 30
  Collected 2 subtask lengths from first episode

[178/397] Processing RoboCOIN/G1edu-u3_pick_plastic_bowl_ac...
  Collected metadata and stats for G1edu u3 30
  Collected 2 subtask lengths from first episode

[179/397] Processing RoboCOIN/G1edu-u3_pick_plastic_bowl_ad...
  Collected metadata and stats for G1edu u3 30
  Collected 2 subtask lengths from first episode

[180/397] Processing RoboCOIN/G1edu-u3_pick_up_the_bottled_water_a...
  Collected metadata and stats for G1edu u3 30
  Collected 2 subtask lengths from first episode

[181/397] Processing RoboCOIN/G1edu-u3_pick_up_the_bottled_water_as...
  Collected metadata and stats for G1edu u3 30
  Collected 3 subtask lengths from first episode

[182/397] Processing RoboCOIN/G1edu-u3_pick_up_the_bottled_water_b...
  Collected metadata and stats for G1edu u3 30
  Collected 3 subtask lengths from first episode

[183/397] Processing RoboCOIN/G1edu-u3_pick_up_the_bread_az...
  Collected metadata and stats for G1edu u3 30
  Collected 2 subtask lengths from first episode

[184/397] Processing RoboCOIN/G1edu-u3_pick_up_the_lemon_a...
  Collected metadata and stats for G1edu u3 30
  Collected 2 subtask lengths from first episode

[185/397] Processing RoboCOIN/G1edu-u3_pick_up_the_lemon_at...
  Collected metadata and stats for G1edu u3 30
  Collected 2 subtask lengths from first episode

[186/397] Processing RoboCOIN/G1edu-u3_pick_up_the_tissue_box_ao...
  Collected metadata and stats for G1edu u3 30
  Collected 2 subtask lengths from first episode

[187/397] Processing RoboCOIN/G1edu-u3_pick_up_the_toy_ai...
  Collected metadata and stats for G1edu u3 30
  Collected 2 subtask lengths from first episode

[188/397] Processing RoboCOIN/G1edu-u3_place_apple_c...
  Collected metadata and stats for G1edu u3 30
  Collected 2 subtask lengths from first episode

[189/397] Processing RoboCOIN/G1edu-u3_place_bottle_c...
  Collected metadata and stats for G1edu u3 30
  Collected 2 subtask lengths from first episode

[190/397] Processing RoboCOIN/G1edu-u3_place_metal_bowl_ae...
  Collected metadata and stats for G1edu u3 30
  Collected 2 subtask lengths from first episode

[191/397] Processing RoboCOIN/G1edu-u3_place_metal_bowl_af...
  Collected metadata and stats for G1edu u3 30
  Collected 2 subtask lengths from first episode

[192/397] Processing RoboCOIN/G1edu-u3_place_plastic_bowl_ag...
  Collected metadata and stats for G1edu u3 30
  Collected 2 subtask lengths from first episode

[193/397] Processing RoboCOIN/G1edu-u3_place_plastic_bowl_ah...
  Collected metadata and stats for G1edu u3 30
  Collected 2 subtask lengths from first episode

[194/397] Processing RoboCOIN/G1edu-u3_plate_storage_doll...
  Collected metadata and stats for G1edu u3 28
  Collected 5 subtask lengths from first episode

[195/397] Processing RoboCOIN/G1edu-u3_plate_storage_rabbit_doll...
  Collected metadata and stats for G1edu u3 28
  Collected 5 subtask lengths from first episode

[196/397] Processing RoboCOIN/G1edu-u3_pullBowl_storage_bread_a...
  Collected metadata and stats for G1edu u3 28
  Collected 6 subtask lengths from first episode

[197/397] Processing RoboCOIN/G1edu-u3_pullBowl_storage_bread_b...
  Collected metadata and stats for G1edu u3 28
  Collected 6 subtask lengths from first episode

[198/397] Processing RoboCOIN/G1edu-u3_pullBowl_storage_bread_unordered_C...
  Collected metadata and stats for G1edu u3 28
  Collected 6 subtask lengths from first episode

[199/397] Processing RoboCOIN/G1edu-u3_pullBowl_storage_bread_unordered_a...
  Collected metadata and stats for G1edu u3 28
  Collected 6 subtask lengths from first episode

[200/397] Processing RoboCOIN/G1edu-u3_pullBowl_storage_bread_unordered_b...
  Collected metadata and stats for G1edu u3 28
  Collected 6 subtask lengths from first episode

[201/397] Processing RoboCOIN/G1edu-u3_put_the_bread_aw...
  Collected metadata and stats for G1edu u3 30
  Collected 2 subtask lengths from first episode

[202/397] Processing RoboCOIN/G1edu-u3_put_the_cup_b...
  Collected metadata and stats for G1edu u3 30
  Collected 2 subtask lengths from first episode

[203/397] Processing RoboCOIN/G1edu-u3_put_the_lemon_af...
  Collected metadata and stats for G1edu u3 30
  Collected 2 subtask lengths from first episode

[204/397] Processing RoboCOIN/G1edu-u3_put_the_lemon_on_the_plate_ah...
  Collected metadata and stats for G1edu u3 30
  Collected 2 subtask lengths from first episode

[205/397] Processing RoboCOIN/G1edu-u3_put_the_tissue_box_al...
  Collected metadata and stats for G1edu u3 30
  Collected 2 subtask lengths from first episode

[206/397] Processing RoboCOIN/G1edu-u3_put_the_toy_ap...
  Collected metadata and stats for G1edu u3 30
  Collected 2 subtask lengths from first episode

[207/397] Processing RoboCOIN/G1edu-u3_put_the_water_bottle_aq...
  Collected metadata and stats for G1edu u3 30
  Collected 2 subtask lengths from first episode

[208/397] Processing RoboCOIN/G1edu-u3_put_the_water_bottle_on_the_table_d...
  Collected metadata and stats for G1edu u3 30
  Collected 2 subtask lengths from first episode

[209/397] Processing RoboCOIN/G1edu-u3_stack_bowls...
  Collected metadata and stats for G1edu u3 28
  Collected 7 subtask lengths from first episode

[210/397] Processing RoboCOIN/G1edu-u3_tray_storage_lemon_a...
  Collected metadata and stats for G1edu u3 30
  Collected 2 subtask lengths from first episode

[211/397] Processing RoboCOIN/Galbot_g1_fold_clothe_b...
  Collected metadata and stats for Galbot g1
  Collected 10 subtask lengths from first episode

[212/397] Processing RoboCOIN/Galbot_g1_fold_clothe_c...
  Collected metadata and stats for Galbot g1
  Collected 10 subtask lengths from first episode

[213/397] Processing RoboCOIN/Galbot_g1_fold_clothe_e...
  Collected metadata and stats for Galbot g1
  Collected 10 subtask lengths from first episode

[214/397] Processing RoboCOIN/Galbot_g1_steamer_storage_baozi_a...
  Collected metadata and stats for Galbot g1
  Collected 9 subtask lengths from first episode

[215/397] Processing RoboCOIN/Galbot_g1_steamer_storage_baozi_b...
  Collected metadata and stats for Galbot g1
  Collected 11 subtask lengths from first episode

[216/397] Processing RoboCOIN/Galbot_g1_steamer_storage_baozi_c...
  Collected metadata and stats for Galbot g1
  Collected 11 subtask lengths from first episode

[217/397] Processing RoboCOIN/Galbot_g1_steamer_storage_baozi_d...
  Collected metadata and stats for Galbot g1
  Collected 9 subtask lengths from first episode

[218/397] Processing RoboCOIN/Galbot_g1_steamer_storage_baozi_e...
  Collected metadata and stats for Galbot g1
  Collected 11 subtask lengths from first episode

[219/397] Processing RoboCOIN/Galbot_g1_steamer_storage_baozi_f...
  Collected metadata and stats for Galbot g1
  Collected 11 subtask lengths from first episode

[220/397] Processing RoboCOIN/Galbot_g1_steamer_storage_baozi_g...
  Collected metadata and stats for Galbot g1
  Collected 11 subtask lengths from first episode

[221/397] Processing RoboCOIN/Galbot_g1_steamer_storage_baozi_h...
  Collected metadata and stats for Galbot g1
  Collected 9 subtask lengths from first episode

[222/397] Processing RoboCOIN/Galbot_g1_steamer_storage_baozi_i...
  Collected metadata and stats for Galbot g1
  Collected 11 subtask lengths from first episode

[223/397] Processing RoboCOIN/Galbot_g1_steamer_storage_baozi_j...
  Collected metadata and stats for Galbot g1
  Collected 11 subtask lengths from first episode

[224/397] Processing RoboCOIN/R1_Lite_boil_water_in_a_kettle...
  Collected metadata and stats for R1 Lite
  Collected 6 subtask lengths from first episode

[225/397] Processing RoboCOIN/R1_Lite_build_blocks...
  Renamed 'R1 Lite' -> 'R1 Lite 14' (state_dim=14)
  Using key 'R1 Lite 16' for R1 Lite with state_dim=16
  Collected metadata and stats for R1 Lite 16
  Collected 9 subtask lengths from first episode

[226/397] Processing RoboCOIN/R1_Lite_catch_the_water...
  Collected metadata and stats for R1 Lite 14
  Collected 5 subtask lengths from first episode

[227/397] Processing RoboCOIN/R1_Lite_clean_the_floor...
  Collected metadata and stats for R1 Lite 14
  Collected 5 subtask lengths from first episode

[228/397] Processing RoboCOIN/R1_Lite_clean_the_sink...
  Collected metadata and stats for R1 Lite 14
  Collected 4 subtask lengths from first episode

[229/397] Processing RoboCOIN/R1_Lite_clean_toilet...
  Collected metadata and stats for R1 Lite 14
  Collected 8 subtask lengths from first episode

[230/397] Processing RoboCOIN/R1_Lite_connect_the_router_cable...
  Collected metadata and stats for R1 Lite 14
  Collected 6 subtask lengths from first episode

[231/397] Processing RoboCOIN/R1_Lite_cook_a_meal...
  Collected metadata and stats for R1 Lite 14
  Collected 15 subtask lengths from first episode

[232/397] Processing RoboCOIN/R1_Lite_cover_the_pot_lid...
  Collected metadata and stats for R1 Lite 14
  Collected 4 subtask lengths from first episode

[233/397] Processing RoboCOIN/R1_Lite_dispose_of_leftover_food...
  Collected metadata and stats for R1 Lite 14
  Collected 4 subtask lengths from first episode

[234/397] Processing RoboCOIN/R1_Lite_drawer_storage_hair_dryer...
  Collected metadata and stats for R1 Lite 14
  Collected 8 subtask lengths from first episode

[235/397] Processing RoboCOIN/R1_Lite_fold_clothes...
  Collected metadata and stats for R1 Lite 14
  Collected 3 subtask lengths from first episode

[236/397] Processing RoboCOIN/R1_Lite_garbage_disposal...
  Collected metadata and stats for R1 Lite 14
  Collected 1 subtask lengths from first episode

[237/397] Processing RoboCOIN/R1_Lite_hang_clothes...
  Collected metadata and stats for R1 Lite 14
  Collected 7 subtask lengths from first episode

[238/397] Processing RoboCOIN/R1_Lite_make_a_landline_call...
  Collected metadata and stats for R1 Lite 14
  Collected 4 subtask lengths from first episode

[239/397] Processing RoboCOIN/R1_Lite_make_breakfast...
  Collected metadata and stats for R1 Lite 14
  Collected 9 subtask lengths from first episode

[240/397] Processing RoboCOIN/R1_Lite_make_tea...
  Collected metadata and stats for R1 Lite 14
  Collected 8 subtask lengths from first episode

[241/397] Processing RoboCOIN/R1_Lite_make_the_bed...
  Collected metadata and stats for R1 Lite 14
  Collected 4 subtask lengths from first episode

[242/397] Processing RoboCOIN/R1_Lite_move_the_position_of_the_apple...
  Collected metadata and stats for R1 Lite 16
  Collected 5 subtask lengths from first episode

[243/397] Processing RoboCOIN/R1_Lite_move_the_position_of_the_black_marker...
  Collected metadata and stats for R1 Lite 16
  Collected 5 subtask lengths from first episode

[244/397] Processing RoboCOIN/R1_Lite_move_the_position_of_the_brush...
  Collected metadata and stats for R1 Lite 16
  Collected 5 subtask lengths from first episode

[245/397] Processing RoboCOIN/R1_Lite_move_the_position_of_the_coffee_capsule...
  Collected metadata and stats for R1 Lite 16
  Collected 5 subtask lengths from first episode

[246/397] Processing RoboCOIN/R1_Lite_move_the_position_of_the_cookie...
  Collected metadata and stats for R1 Lite 16
  Collected 5 subtask lengths from first episode

[247/397] Processing RoboCOIN/R1_Lite_move_the_position_of_the_duck...
  Collected metadata and stats for R1 Lite 16
  Collected 5 subtask lengths from first episode

[248/397] Processing RoboCOIN/R1_Lite_move_the_position_of_the_glass...
  Collected metadata and stats for R1 Lite 16
  Collected 5 subtask lengths from first episode

[249/397] Processing RoboCOIN/R1_Lite_move_the_position_of_the_long_bread...
  Collected metadata and stats for R1 Lite 16
  Collected 5 subtask lengths from first episode

[250/397] Processing RoboCOIN/R1_Lite_move_the_position_of_the_milk...
  Collected metadata and stats for R1 Lite 16
  Collected 7 subtask lengths from first episode

[251/397] Processing RoboCOIN/R1_Lite_move_the_position_of_the_orange...
  Collected metadata and stats for R1 Lite 16
  Collected 5 subtask lengths from first episode

[252/397] Processing RoboCOIN/R1_Lite_move_the_position_of_the_peeler...
  Collected metadata and stats for R1 Lite 16
  Collected 5 subtask lengths from first episode

[253/397] Processing RoboCOIN/R1_Lite_move_the_position_of_the_pen...
  Collected metadata and stats for R1 Lite 16
  Collected 5 subtask lengths from first episode

[254/397] Processing RoboCOIN/R1_Lite_move_the_position_of_the_rubiks_cube...
  Collected metadata and stats for R1 Lite 16
  Collected 5 subtask lengths from first episode

[255/397] Processing RoboCOIN/R1_Lite_move_the_position_of_the_soda...
  Collected metadata and stats for R1 Lite 16
  Collected 5 subtask lengths from first episode

[256/397] Processing RoboCOIN/R1_Lite_move_the_position_of_the_spoon...
  Collected metadata and stats for R1 Lite 16
  Collected 5 subtask lengths from first episode

[257/397] Processing RoboCOIN/R1_Lite_move_the_position_of_the_triangle_bread...
  Collected metadata and stats for R1 Lite 16
  Collected 5 subtask lengths from first episode

[258/397] Processing RoboCOIN/R1_Lite_open_and_close_curtains...
  Collected metadata and stats for R1 Lite 14
  Collected 4 subtask lengths from first episode

[259/397] Processing RoboCOIN/R1_Lite_open_and_close_microwave_oven...
  Collected metadata and stats for R1 Lite 14
  Collected 7 subtask lengths from first episode

[260/397] Processing RoboCOIN/R1_Lite_open_and_close_nightstand_door...
  Collected metadata and stats for R1 Lite 14
  Collected 6 subtask lengths from first episode

[261/397] Processing RoboCOIN/R1_Lite_open_and_close_nightstand_drawer...
  Collected metadata and stats for R1 Lite 14
  Collected 6 subtask lengths from first episode

[262/397] Processing RoboCOIN/R1_Lite_open_and_close_the_freezer_door...
  Collected metadata and stats for R1 Lite 14
  Collected 7 subtask lengths from first episode

[263/397] Processing RoboCOIN/R1_Lite_open_the_food_pan...
  Collected metadata and stats for R1 Lite 14
  Collected 4 subtask lengths from first episode

[264/397] Processing RoboCOIN/R1_Lite_opening_and_closing_aalcony_sliding_doors...
  Collected metadata and stats for R1 Lite 14
  Collected 2 subtask lengths from first episode

[265/397] Processing RoboCOIN/R1_Lite_peach_storage...
  Collected metadata and stats for R1 Lite 16
  Collected 6 subtask lengths from first episode

[266/397] Processing RoboCOIN/R1_Lite_pick_up_and_store_items...
  Collected metadata and stats for R1 Lite 14
  Collected 2 subtask lengths from first episode

[267/397] Processing RoboCOIN/R1_Lite_place_the_dress_shirt_on_the_hanger...
  Collected metadata and stats for R1 Lite 14
  Collected 5 subtask lengths from first episode

[268/397] Processing RoboCOIN/R1_Lite_plug_the_socket...
  Collected metadata and stats for R1 Lite 14
  Collected 3 subtask lengths from first episode

[269/397] Processing RoboCOIN/R1_Lite_pour_water...
  Collected metadata and stats for R1 Lite 14
  Collected 5 subtask lengths from first episode

[270/397] Processing RoboCOIN/R1_Lite_put_on_a_garbage_bag...
  Collected metadata and stats for R1 Lite 14
  Collected 2 subtask lengths from first episode

[271/397] Processing RoboCOIN/R1_Lite_put_slippers_into_floor_standing_shoe_cabinet...
  Collected metadata and stats for R1 Lite 14
  Collected 4 subtask lengths from first episode

[272/397] Processing RoboCOIN/R1_Lite_put_the_pillow_on_the_bed...
  Collected metadata and stats for R1 Lite 14
  Collected 6 subtask lengths from first episode

[273/397] Processing RoboCOIN/R1_Lite_put_the_shoes_into_the_shoe_box...
  Collected metadata and stats for R1 Lite 14
  Collected 5 subtask lengths from first episode

[274/397] Processing RoboCOIN/R1_Lite_put_the_tableware_into_the_cupboard...
  Collected metadata and stats for R1 Lite 14
  Collected 11 subtask lengths from first episode

[275/397] Processing RoboCOIN/R1_Lite_sliding_chair...
  Collected metadata and stats for R1 Lite 14
  Collected 4 subtask lengths from first episode

[276/397] Processing RoboCOIN/R1_Lite_stack_baskets...
  Collected metadata and stats for R1 Lite 16
  Collected 7 subtask lengths from first episode

[277/397] Processing RoboCOIN/R1_Lite_storage_of_toiletries...
  Collected metadata and stats for R1 Lite 14
  Collected 6 subtask lengths from first episode

[278/397] Processing RoboCOIN/R1_Lite_switch_labels...
  Collected metadata and stats for R1 Lite 14
  Collected 6 subtask lengths from first episode

[279/397] Processing RoboCOIN/R1_Lite_switch_on_and_off_the_central_air_conditioning...
  Collected metadata and stats for R1 Lite 14
  Collected 3 subtask lengths from first episode

[280/397] Processing RoboCOIN/R1_Lite_tableware_arrangement...
  Collected metadata and stats for R1 Lite 14
  Collected 12 subtask lengths from first episode

[281/397] Processing RoboCOIN/R1_Lite_tableware_cleaning...
  Collected metadata and stats for R1 Lite 14
  Collected 18 subtask lengths from first episode

[282/397] Processing RoboCOIN/R1_Lite_take_and_place_the_portable_power_bank...
  Collected metadata and stats for R1 Lite 14
  Collected 7 subtask lengths from first episode

[283/397] Processing RoboCOIN/R1_Lite_take_and_put_away_garden_stuff...
  Collected metadata and stats for R1 Lite 14
  Collected 8 subtask lengths from first episode

[284/397] Processing RoboCOIN/R1_Lite_take_and_put_away_garden_stuff_a...
  Collected metadata and stats for R1 Lite 14
  Collected 12 subtask lengths from first episode

[285/397] Processing RoboCOIN/R1_Lite_take_and_put_away_items...
  Collected metadata and stats for R1 Lite 14
  Collected 6 subtask lengths from first episode

[286/397] Processing RoboCOIN/R1_Lite_take_and_put_the_bowl...
  Collected metadata and stats for R1 Lite 14
  Collected 5 subtask lengths from first episode

[287/397] Processing RoboCOIN/R1_Lite_take_clothes_out_of_the_washing_machine...
  Collected metadata and stats for R1 Lite 14
  Collected 6 subtask lengths from first episode

[288/397] Processing RoboCOIN/R1_Lite_take_or_store_plates...
  Collected metadata and stats for R1 Lite 14
  Collected 4 subtask lengths from first episode

[289/397] Processing RoboCOIN/R1_Lite_tea_service_table_setting...
  Collected metadata and stats for R1 Lite 14
  Collected 6 subtask lengths from first episode

[290/397] Processing RoboCOIN/R1_Lite_throw_out_the_trash...
  Collected metadata and stats for R1 Lite 14
  Collected 3 subtask lengths from first episode

[291/397] Processing RoboCOIN/R1_Lite_tidy_up_toiletries...
  Collected metadata and stats for R1 Lite 14
  Collected 4 subtask lengths from first episode

[292/397] Processing RoboCOIN/R1_Lite_wash_the_tableware...
  Collected metadata and stats for R1 Lite 14
  Collected 9 subtask lengths from first episode

[293/397] Processing RoboCOIN/R1_Lite_washing_board...
  Collected metadata and stats for R1 Lite 14
  Collected 7 subtask lengths from first episode

[294/397] Processing RoboCOIN/R1_Lite_wipe_the_table...
  Collected metadata and stats for R1 Lite 14
  Collected 3 subtask lengths from first episode

[295/397] Processing RoboCOIN/RMC-AIDA-L_basket_storage_banana...
  Collected metadata and stats for RMC AIDA
  Collected 5 subtask lengths from first episode

[296/397] Processing RoboCOIN/RMC-AIDA-L_basket_storage_egg_yolk_pastry...
  Collected metadata and stats for RMC AIDA
  Collected 4 subtask lengths from first episode

[297/397] Processing RoboCOIN/RMC-AIDA-L_basket_storage_long_bread...
  Collected metadata and stats for RMC AIDA
  Collected 5 subtask lengths from first episode

[298/397] Processing RoboCOIN/RMC-AIDA-L_basket_storage_orange...
  Collected metadata and stats for RMC AIDA
  Collected 5 subtask lengths from first episode

[299/397] Processing RoboCOIN/RMC-AIDA-L_basket_storage_peach...
  Collected metadata and stats for RMC AIDA
  Collected 5 subtask lengths from first episode

[300/397] Processing RoboCOIN/RMC-AIDA-L_box_up_down...
  Collected metadata and stats for RMC AIDA
  Collected 5 subtask lengths from first episode

[301/397] Processing RoboCOIN/RMC-AIDA-L_clean_table...
  Collected metadata and stats for RMC AIDA
  Collected 6 subtask lengths from first episode

[302/397] Processing RoboCOIN/RMC-AIDA-L_desktop_organization...
  Collected metadata and stats for RMC AIDA
  Collected 13 subtask lengths from first episode

[303/397] Processing RoboCOIN/RMC-AIDA-L_fold_shirt...
  Collected metadata and stats for RMC AIDA
  Collected 11 subtask lengths from first episode

[304/397] Processing RoboCOIN/RMC-AIDA-L_fold_shorts...
  Collected metadata and stats for RMC AIDA
  Collected 3 subtask lengths from first episode

[305/397] Processing RoboCOIN/RMC-AIDA-L_fold_towel...
  Collected metadata and stats for RMC AIDA
  Collected 3 subtask lengths from first episode

[306/397] Processing RoboCOIN/RMC-AIDA-L_food_packaging...
  Collected metadata and stats for RMC AIDA
  Collected 12 subtask lengths from first episode

[307/397] Processing RoboCOIN/RMC-AIDA-L_food_storage...
  Collected metadata and stats for RMC AIDA
  Collected 5 subtask lengths from first episode

[308/397] Processing RoboCOIN/RMC-AIDA-L_fruit_storage...
  Collected metadata and stats for RMC AIDA
  Collected 6 subtask lengths from first episode

[309/397] Processing RoboCOIN/RMC-AIDA-L_get_water...
  Collected metadata and stats for RMC AIDA
  Collected 4 subtask lengths from first episode

[310/397] Processing RoboCOIN/RMC-AIDA-L_glasses_storage...
  Collected metadata and stats for RMC AIDA
  Collected 7 subtask lengths from first episode

[311/397] Processing RoboCOIN/RMC-AIDA-L_organise_the_document_bag...
  Collected metadata and stats for RMC AIDA
  Collected 4 subtask lengths from first episode

[312/397] Processing RoboCOIN/RMC-AIDA-L_place_test_tube...
  Collected metadata and stats for RMC AIDA
  Collected 4 subtask lengths from first episode

[313/397] Processing RoboCOIN/RMC-AIDA-L_place_the_fruits_repeatedly...
  Collected metadata and stats for RMC AIDA
  Collected 14 subtask lengths from first episode

[314/397] Processing RoboCOIN/RMC-AIDA-L_place_towel...
  Collected metadata and stats for RMC AIDA
  Collected 5 subtask lengths from first episode

[315/397] Processing RoboCOIN/RMC-AIDA-L_plate_storage...
  Collected metadata and stats for RMC AIDA
  Collected 4 subtask lengths from first episode

[316/397] Processing RoboCOIN/RMC-AIDA-L_pour_coffee_beans...
  Collected metadata and stats for RMC AIDA
  Collected 5 subtask lengths from first episode

[317/397] Processing RoboCOIN/RMC-AIDA-L_pour_rice...
  Collected metadata and stats for RMC AIDA
  Collected 6 subtask lengths from first episode

[318/397] Processing RoboCOIN/RMC-AIDA-L_pour_tea...
  Collected metadata and stats for RMC AIDA
  Collected 6 subtask lengths from first episode

[319/397] Processing RoboCOIN/RMC-AIDA-L_pull_open_bag...
  Collected metadata and stats for RMC AIDA
  Collected 3 subtask lengths from first episode

[320/397] Processing RoboCOIN/RMC-AIDA-L_stack_baskets...
  Collected metadata and stats for RMC AIDA
  Collected 5 subtask lengths from first episode

[321/397] Processing RoboCOIN/RMC-AIDA-L_stir_coffee...
  Collected metadata and stats for RMC AIDA
  Collected 4 subtask lengths from first episode

[322/397] Processing RoboCOIN/RMC-AIDA-L_storage_bin_storage...
  Collected metadata and stats for RMC AIDA
  Collected 29 subtask lengths from first episode

[323/397] Processing RoboCOIN/Split_aloha_basket_storage_banana...
  Collected metadata and stats for Split aloha
  Collected 5 subtask lengths from first episode

[324/397] Processing RoboCOIN/Split_aloha_basket_storage_bread...
  Collected metadata and stats for Split aloha
  Collected 3 subtask lengths from first episode

[325/397] Processing RoboCOIN/Split_aloha_basket_storage_egg_yolk_pastry...
  Collected metadata and stats for Split aloha
  Collected 6 subtask lengths from first episode

[326/397] Processing RoboCOIN/Split_aloha_basket_storage_long_bread...
  Collected metadata and stats for Split aloha
  Collected 5 subtask lengths from first episode

[327/397] Processing RoboCOIN/Split_aloha_basket_storage_orange...
  Collected metadata and stats for Split aloha
  Collected 6 subtask lengths from first episode

[328/397] Processing RoboCOIN/Split_aloha_basket_storage_peach...
  Collected metadata and stats for Split aloha
  Collected 3 subtask lengths from first episode

[329/397] Processing RoboCOIN/Split_aloha_fold_the_pants...
  Collected metadata and stats for Split aloha
  Collected 2 subtask lengths from first episode

[330/397] Processing RoboCOIN/Split_aloha_plate_storage...
  Collected metadata and stats for Split aloha
  Collected 3 subtask lengths from first episode

[331/397] Processing RoboCOIN/Split_aloha_pour_rice...
  Collected metadata and stats for Split aloha
  Collected 5 subtask lengths from first episode

[332/397] Processing RoboCOIN/Split_aloha_pour_tea...
  Collected metadata and stats for Split aloha
  Collected 6 subtask lengths from first episode

[333/397] Processing RoboCOIN/Split_aloha_scoop_coffee_beans...
  Collected metadata and stats for Split aloha
  Collected 4 subtask lengths from first episode

[334/397] Processing RoboCOIN/Split_aloha_stack_baskets...
  Collected metadata and stats for Split aloha
  Collected 3 subtask lengths from first episode

[335/397] Processing RoboCOIN/Split_aloha_stir_coffee...
  Collected metadata and stats for Split aloha
  Collected 3 subtask lengths from first episode

[336/397] Processing RoboCOIN/Split_aloha_wipe_table...
  Collected metadata and stats for Split aloha
  Collected 9 subtask lengths from first episode

[337/397] Processing RoboCOIN/Split_aloha_wipe_the_table...
  Collected metadata and stats for Split aloha
  Collected 2 subtask lengths from first episode

[338/397] Processing RoboCOIN/Split_aloha_zip_up_the_document_bag...
  Collected metadata and stats for Split aloha
  Collected 3 subtask lengths from first episode

[339/397] Processing RoboCOIN/Tianqin_A2_box_storage_part...
  Collected metadata and stats for Tianqin A2
  Collected 3 subtask lengths from first episode

[340/397] Processing RoboCOIN/Tianqin_A2_container_storage_graphics_card...
  Collected metadata and stats for Tianqin A2
  Collected 6 subtask lengths from first episode

[341/397] Processing RoboCOIN/Tianqin_A2_place_the_paper_box...
  Collected metadata and stats for Tianqin A2
  Collected 3 subtask lengths from first episode

[342/397] Processing RoboCOIN/alpha_bot_2_carry_the_clothes_basket...
  Collected metadata and stats for alpha bot
  Collected 4 subtask lengths from first episode

[343/397] Processing RoboCOIN/alpha_bot_2_item_reversal...
  Collected metadata and stats for alpha bot
  Collected 4 subtask lengths from first episode

[344/397] Processing RoboCOIN/alpha_bot_2_move_the_table...
  Collected metadata and stats for alpha bot
  Collected 3 subtask lengths from first episode

[345/397] Processing RoboCOIN/alpha_bot_2_operate_the_microwave_oven...
  Collected metadata and stats for alpha bot
  Collected 5 subtask lengths from first episode

[346/397] Processing RoboCOIN/alpha_bot_2_pass_the_sandbag...
  Collected metadata and stats for alpha bot
  Collected 4 subtask lengths from first episode

[347/397] Processing RoboCOIN/alpha_bot_2_press_the_button_a...
  Collected metadata and stats for alpha bot
  Collected 2 subtask lengths from first episode

[348/397] Processing RoboCOIN/alpha_bot_2_press_the_button_b...
  Collected metadata and stats for alpha bot
  Collected 4 subtask lengths from first episode

[349/397] Processing RoboCOIN/alpha_bot_2_recover_after_touching_an_obstacle...
  Collected metadata and stats for alpha bot
  Collected 3 subtask lengths from first episode

[350/397] Processing RoboCOIN/alpha_bot_2_stack_building_blocks...
  Collected metadata and stats for alpha bot
  Collected 7 subtask lengths from first episode

[351/397] Processing RoboCOIN/alpha_bot_2_sticker...
  Collected metadata and stats for alpha bot
  Collected 2 subtask lengths from first episode

[352/397] Processing RoboCOIN/leju_robot_box_storage_parcel...
  Collected metadata and stats for leju robot
  Collected 4 subtask lengths from first episode

[353/397] Processing RoboCOIN/leju_robot_box_storage_parcel_a...
  Collected metadata and stats for leju robot
  Collected 4 subtask lengths from first episode

[354/397] Processing RoboCOIN/leju_robot_box_storage_parcel_b...
  Collected metadata and stats for leju robot
  Collected 4 subtask lengths from first episode

[355/397] Processing RoboCOIN/leju_robot_box_storage_parcel_c...
  Collected metadata and stats for leju robot
  Collected 4 subtask lengths from first episode

[356/397] Processing RoboCOIN/leju_robot_box_storage_parcel_f...
  Collected metadata and stats for leju robot
  Collected 4 subtask lengths from first episode

[357/397] Processing RoboCOIN/leju_robot_box_storage_parcel_g...
  Collected metadata and stats for leju robot
  Collected 4 subtask lengths from first episode

[358/397] Processing RoboCOIN/leju_robot_box_storage_parcel_h...
  Collected metadata and stats for leju robot
  Collected 4 subtask lengths from first episode

[359/397] Processing RoboCOIN/leju_robot_hotel_services_a...
  Collected metadata and stats for leju robot
  Collected 5 subtask lengths from first episode

[360/397] Processing RoboCOIN/leju_robot_hotel_services_aa...
  Collected metadata and stats for leju robot
  Collected 2 subtask lengths from first episode

[361/397] Processing RoboCOIN/leju_robot_hotel_services_ab...
  Collected metadata and stats for leju robot
  Collected 2 subtask lengths from first episode

[362/397] Processing RoboCOIN/leju_robot_hotel_services_ac...
  Collected metadata and stats for leju robot
  Collected 2 subtask lengths from first episode

[363/397] Processing RoboCOIN/leju_robot_hotel_services_ad...
  Collected metadata and stats for leju robot
  Collected 2 subtask lengths from first episode

[364/397] Processing RoboCOIN/leju_robot_hotel_services_ae...
  Collected metadata and stats for leju robot
  Collected 2 subtask lengths from first episode

[365/397] Processing RoboCOIN/leju_robot_hotel_services_af...
  Collected metadata and stats for leju robot
  Collected 2 subtask lengths from first episode

[366/397] Processing RoboCOIN/leju_robot_hotel_services_ag...
  Collected metadata and stats for leju robot
  Collected 2 subtask lengths from first episode

[367/397] Processing RoboCOIN/leju_robot_hotel_services_ah...
  Collected metadata and stats for leju robot
  Collected 2 subtask lengths from first episode

[368/397] Processing RoboCOIN/leju_robot_hotel_services_b...
  Collected metadata and stats for leju robot
  Collected 5 subtask lengths from first episode

[369/397] Processing RoboCOIN/leju_robot_hotel_services_c...
  Collected metadata and stats for leju robot
  Collected 5 subtask lengths from first episode

[370/397] Processing RoboCOIN/leju_robot_hotel_services_d...
  Collected metadata and stats for leju robot
  Collected 5 subtask lengths from first episode

[371/397] Processing RoboCOIN/leju_robot_hotel_services_e...
  Collected metadata and stats for leju robot
  Collected 5 subtask lengths from first episode

[372/397] Processing RoboCOIN/leju_robot_hotel_services_f...
  Collected metadata and stats for leju robot
  Collected 5 subtask lengths from first episode

[373/397] Processing RoboCOIN/leju_robot_hotel_services_h...
  Renamed 'leju robot' -> 'leju robot 118' (state_dim=118)
  Using key 'leju robot 54' for leju robot with state_dim=54
  Collected metadata and stats for leju robot 54
  Collected 2 subtask lengths from first episode

[374/397] Processing RoboCOIN/leju_robot_hotel_services_i...
  Collected metadata and stats for leju robot 54
  Collected 2 subtask lengths from first episode

[375/397] Processing RoboCOIN/leju_robot_moving_parts_a...
  Collected metadata and stats for leju robot 118
  Collected 4 subtask lengths from first episode

[376/397] Processing RoboCOIN/leju_robot_moving_parts_b...
  Collected metadata and stats for leju robot 118
  Collected 4 subtask lengths from first episode

[377/397] Processing RoboCOIN/leju_robot_moving_parts_c...
  Collected metadata and stats for leju robot 118
  Collected 4 subtask lengths from first episode

[378/397] Processing RoboCOIN/leju_robot_moving_parts_f...
  Collected metadata and stats for leju robot 118
  Collected 4 subtask lengths from first episode

[379/397] Processing RoboCOIN/leju_robot_moving_parts_g...
  Collected metadata and stats for leju robot 118
  Collected 4 subtask lengths from first episode

[380/397] Processing RoboCOIN/leju_robot_moving_parts_h...
  Collected metadata and stats for leju robot 118
  Collected 4 subtask lengths from first episode

[381/397] Processing RoboCOIN/leju_robot_moving_parts_i...
  Collected metadata and stats for leju robot 118
  Collected 4 subtask lengths from first episode

[382/397] Processing RoboCOIN/leju_robot_moving_parts_j...
  Collected metadata and stats for leju robot 118
  Collected 4 subtask lengths from first episode

[383/397] Processing RoboCOIN/leju_robot_moving_parts_k...
  Collected metadata and stats for leju robot 118
  Collected 4 subtask lengths from first episode

[384/397] Processing RoboCOIN/leju_robot_moving_parts_m...
  Collected metadata and stats for leju robot 118
  Collected 4 subtask lengths from first episode

[385/397] Processing RoboCOIN/leju_robot_moving_parts_n...
  Collected metadata and stats for leju robot 118
  Collected 4 subtask lengths from first episode

[386/397] Processing RoboCOIN/leju_robot_moving_parts_o...
  Collected metadata and stats for leju robot 118
  Collected 4 subtask lengths from first episode

[387/397] Processing RoboCOIN/leju_robot_moving_parts_q...
  Collected metadata and stats for leju robot 118
  Collected 6 subtask lengths from first episode

[388/397] Processing RoboCOIN/leju_robot_moving_parts_r...
  Collected metadata and stats for leju robot 118
  Collected 4 subtask lengths from first episode

[389/397] Processing RoboCOIN/leju_robot_moving_parts_s...
  Collected metadata and stats for leju robot 118
  Collected 4 subtask lengths from first episode

[390/397] Processing RoboCOIN/leju_robot_moving_parts_t...
  Collected metadata and stats for leju robot 118
  Collected 4 subtask lengths from first episode

[391/397] Processing RoboCOIN/leju_robot_moving_parts_u...
  Collected metadata and stats for leju robot 118
  Collected 4 subtask lengths from first episode

[392/397] Processing RoboCOIN/leju_robot_part_placement...
  Collected metadata and stats for leju robot 118
  Collected 4 subtask lengths from first episode

[393/397] Processing RoboCOIN/leju_robot_pass_the_cleaner_a...
  Collected metadata and stats for leju robot 118
  Collected 2 subtask lengths from first episode

[394/397] Processing RoboCOIN/leju_robot_pass_the_cleaner_b...
  Collected metadata and stats for leju robot 118
  Collected 2 subtask lengths from first episode

[395/397] Processing RoboCOIN/leju_robot_pass_the_cleaner_c...
  Collected metadata and stats for leju robot 118
  Collected 2 subtask lengths from first episode

[396/397] Processing RoboCOIN/leju_robot_pass_the_cleaner_d...
  Collected metadata and stats for leju robot 118
  Collected 2 subtask lengths from first episode

[397/397] Processing RoboCOIN/leju_robot_pass_the_cleaner_e...
  Collected metadata and stats for leju robot 118
  Collected 2 subtask lengths from first episode
Saved histogram to /home/saksham3/projects/AIRe/robocoin/survey_scripts/plots/episode_lengths_histogram.png
Saved histogram to /home/saksham3/projects/AIRe/robocoin/survey_scripts/plots/episode_steps_histogram.png
Saved histogram to /home/saksham3/projects/AIRe/robocoin/survey_scripts/plots/subtask_lengths_histogram.png
Saved histogram to /home/saksham3/projects/AIRe/robocoin/survey_scripts/plots/subtask_steps_histogram.png

Wrote repo metadata to /home/saksham3/projects/AIRe/robocoin/survey_scripts/stats/info.json
Wrote episode length quantiles to /home/saksham3/projects/AIRe/robocoin/survey_scripts/stats/episode_length_quantiles.json
Wrote episode steps quantiles to /home/saksham3/projects/AIRe/robocoin/survey_scripts/stats/episode_steps_quantiles.json
Wrote subtask length quantiles to /home/saksham3/projects/AIRe/robocoin/survey_scripts/stats/subtask_length_quantiles.json
Wrote subtask steps quantiles to /home/saksham3/projects/AIRe/robocoin/survey_scripts/stats/subtask_steps_quantiles.json
Wrote normalization stats to /home/saksham3/projects/AIRe/robocoin/survey_scripts/stats/norm_stats.json

============================================================
SUMMARY
============================================================
Total repos processed: 397
Unique robot types: 16
  AIRBOT MMK2: ['camera_names', 'state_names', 'action_names', 'observation.state', 'action', 'eef_sim_pose_state', 'eef_sim_pose_action']
  AgiBot g1 41: ['camera_names', 'state_names', 'action_names', 'observation.state', 'action', 'eef_sim_pose_state', 'eef_sim_pose_action']
  AgiBot g1 17: ['camera_names', 'state_names', 'action_names', 'observation.state', 'action', 'eef_sim_pose_state', 'eef_sim_pose_action']
  Cobot Magic 14: ['camera_names', 'state_names', 'action_names', 'observation.state', 'action', 'eef_sim_pose_state', 'eef_sim_pose_action']
  Cobot Magic 26: ['camera_names', 'state_names', 'action_names', 'observation.state', 'action', 'eef_sim_pose_state', 'eef_sim_pose_action']
  G1edu u3 28: ['camera_names', 'state_names', 'action_names', 'observation.state', 'action', 'eef_sim_pose_state', 'eef_sim_pose_action']
  G1edu u3 30: ['camera_names', 'state_names', 'action_names', 'observation.state', 'action', 'eef_sim_pose_state', 'eef_sim_pose_action']
  Galbot g1: ['camera_names', 'state_names', 'action_names', 'observation.state', 'action', 'eef_sim_pose_state', 'eef_sim_pose_action']
  R1 Lite 14: ['camera_names', 'state_names', 'action_names', 'observation.state', 'action', 'eef_sim_pose_state', 'eef_sim_pose_action']
  R1 Lite 16: ['camera_names', 'state_names', 'action_names', 'observation.state', 'action', 'eef_sim_pose_state', 'eef_sim_pose_action']
  RMC AIDA: ['camera_names', 'state_names', 'action_names', 'observation.state', 'action', 'eef_sim_pose_state', 'eef_sim_pose_action']
  Split aloha: ['camera_names', 'state_names', 'action_names', 'observation.state', 'action', 'eef_sim_pose_state', 'eef_sim_pose_action']
  Tianqin A2: ['camera_names', 'state_names', 'action_names', 'observation.state', 'action', 'eef_sim_pose_state', 'eef_sim_pose_action']
  alpha bot: ['camera_names', 'state_names', 'action_names', 'observation.state', 'action', 'eef_sim_pose_state', 'eef_sim_pose_action']
  leju robot 118: ['camera_names', 'state_names', 'action_names', 'observation.state', 'action', 'eef_sim_pose_state', 'eef_sim_pose_action']
  leju robot 54: ['camera_names', 'state_names', 'action_names', 'observation.state', 'action', 'eef_sim_pose_state', 'eef_sim_pose_action']

Episode Length Quantiles (seconds):
  Count: 100785 episodes
  Mean: 24.88s
  Std: 20.26s
  0%: 1.46s
  10%: 7.57s
  25%: 11.73s
  50%: 18.23s
  75%: 31.57s
  90%: 51.93s
  100%: 223.37s

Episode Steps Quantiles (data points):
  Count: 100785 episodes
  Mean: 754
  Std: 605
  0%: 59
  10%: 236
  25%: 362
  50%: 557
  75%: 952
  90%: 1561
  100%: 6701

Subtask Length Quantiles (seconds):
  Count: 1842 subtasks
  Mean: 4.71s
  Std: 5.04s
  0%: 0.03s
  10%: 1.00s
  25%: 1.77s
  50%: 3.30s
  75%: 5.59s
  90%: 9.70s
  100%: 62.47s

Subtask Steps Quantiles (data points):
  Count: 1842 subtasks
  Mean: 143
  Std: 154
  0%: 1
  10%: 30
  25%: 54
  50%: 102
  75%: 169
  90%: 293
  100%: 1874
============================================================
